comment,source,title
6,央视网,习近平同菲律宾总统谈了哪些话题？
5041,国际锐评,美国作为头号毒株流行国，居然贼喊捉贼
3,许医生科普,第二波疫情高峰什么时候来？钟南山院士预测：疫情结束时间
2,仁墨行,又出现新毒株？胡锡进：我们要做好三个准备
70,王耳朵的观点,XBB登陆杭州上海：二次感染症状有多重？3位亲历者说出自己的感受
30,曼心怡,张文宏：第二波感染高峰时间预测出炉，放开后是否过于乐观？
135,红星新闻,杭州女子后怕：80岁老父亲阳了没发烧没咳嗽，结果一查半个肺都白了！这些情况一定要就医
1368,小丁看体娱,蔡明，一切都该结束了
5,白日要做梦,疫情高峰期将至！关于年货储备，我的两条建议
4869,娜娜说谈,此人连续6年提议禁放烟花爆竹，最终通过！网友：缺少一点年味！
103,八零姑娘V,烟花还没解禁，河南名声倒先臭了
28评论,家庭早教师可妈,奥密克戎后劲太大？阳康后别大意，出现5种情况可能是后遗症
1万评论,一条,重症高峰正在到来，殡葬公司每天对接200个家庭
6评论,医食参考,与春运赛跑！官方发布新十二条，针对基层农村即将到来的“感染大潮”下死任务！
17评论,深秋曲豆,新冠会通过空气传播吗？足不出户会感染吗？
26评论,臻见君,警惕！第2波感染高峰来袭，可能后面还有2波，7类人群首当其冲！
108评论,喵喵小咪很厉害,40岁王凯：不恋爱，不渴望婚姻，不在乎红不红，他为何如此佛系
5评论,发明人创业录,这些院士对于控制新冠疫情无能为力，控制医院倒是头头是道
14评论,宇宙观察室,退烧后为何还会出现白肺？如果出现这4个现象，一定要及时就医！
791评论,红星新闻,“我儿子不行了！”上海年轻妈妈带着儿子看雪景，发完两条信息后再也联系不上了……找到时孩子已失温
1评论,韩成科,传达出三重意义！中央大力支持两地恢复通关，香港经济即将复兴
